0			
298	（笑いすぎじゃと思うのじゃが････）	6471 598	
299	ベテランすぎ	6471 584	
300	息子	6471 585	
301	notice	6468 286	
302	「スピリッツブラスター」	6471 602	linebreak
	について話し合っているようです		linebreak
	耳を傾けますか？		
303	ピンチになっても、スピリッツブラスター	6471 603	linebreak
	になれば逆転のチャンスができるわい		
304	スピリッツブラスターになりたいなら	6471 604	linebreak
	攻撃を当てることと敵にガードされないこと		linebreak
	が有効ですね父さん、まあ攻撃を受けてても		linebreak
	なりますけど父さんには危険ですね		
305	体力が衰えたワシも、	6471 605	linebreak
	スピリッツブラスターになれば		linebreak
	のけぞることなく攻撃できるしのう		
306	そうはいっても父さん、ＨＰがなくなれば	6471 606	linebreak
	効果が切れてしまいますし、回復晶術などを		linebreak
	かけても効果が早く切れてしまいますよ		
307	そんな細かいことは気にせんわい	6471 607	linebreak
	ワシの最高の秘奥義はスピリッツブラスター		linebreak
	にならんと見せれんでの		
308	いえ父さん　確かに秘奥義はＳＰを多く	6471 608	linebreak
	消費しますが、敵を倒すことでＳＰが		linebreak
	回復することを利用すると秘奥義を		linebreak
	出せることもあるようです		
309	ただ、弓使いにはスピリッツブラスター	6471 609	linebreak
	状態を利用して、追加晶術のかわりに		linebreak
	秘奥義を出せる人もいるらしいですよ		linebreak
	父さん		
310	まあ奥義がヒットしても敵がのけぞって	6471 610	linebreak
	ないと秘奥義にはいけぬから、		linebreak
	浮かす奥義だと重い敵にはうまく		linebreak
	いかんこともあるがの		
311	そんなわけでさっそく二人で	6471 611	linebreak
	秘奥義を出しにいこうではないか		
312	いえ父さん　私は晶術使いなんで	6471 612	linebreak
	秘奥義なんて使わないんですよ		
313	というか秘奥義の後はＳＰが０になるから	6471 613	linebreak
	すごいジャマなんですよ父さん		linebreak
	とどめもさせないのに秘奥義		linebreak
	しないでください父さん		
314	ジャマなんで	6471 614	
315	（一回言えば分かると思うが･･･）	6471 615	
316	ベテランすぎ	6471 584	
317	息子	6471 585	
318	notice	6468 286	
319	「フィールドオブエフェクト」	6471 619	linebreak
	について話し合っているようです		linebreak
	耳を傾けますか？		
320	この間の、敵が出す	6471 620	linebreak
	「フィールドオブエフェクト」には		linebreak
	ほとほと手を焼いたわい		
321	略してＦＯＥ（フォエ）ですね父さん	6471 621	linebreak
	あれには大きく二種類があって、		linebreak
	範囲内の敵たちに効果があるのと、		linebreak
	こちらの能力を下げるものがありますね		
322	あれが出たらお手上げかのう	6471 622	
323	あきらめるのは早いです父さん	6471 623	linebreak
	時間で切れるものや、ヒットを重ねることで		linebreak
	切れるものもあるんです		linebreak
	もちろん、とどめをさせば消えますしね		
324	こちらに効果のあるものを出されたら、	6471 624	linebreak
	前衛を一人だけにして術を使うのが		linebreak
	いいかのう		
325	そうですね父さん　でもやはり状態変化に	6471 625	linebreak
	応じて作戦を変えるのがいいようですよ		linebreak
	敵に効果がある場合は、スペクタクルズを		linebreak
	使えば内容が分かりますし		
326	それはそうと最近の若者は	6471 626	linebreak
	なんでもかんでも略したがって困るわい		
327	（言うのが遅いよ父さん････）	6471 627	
328	notice	6468 286	
329	「バトルグレード」について	6471 629	linebreak
	話し合っているようです		linebreak
	耳を傾けますか？		
330	バトルグレードって結局なにさ？	6471 630	
331	戦闘中の様々な行動を集計して、	6471 631	linebreak
	「戦闘のうまさ」を図るものでしたね先輩		linebreak
	ダメージの比率とか、空振りとか、		linebreak
	同じ技ばかりを使うことも審査されます		
332	高い得点を目指したい場合、	6471 632	linebreak
	やはりテクニカルスマッシュを目指しつつ、		linebreak
	エンチャントを織り交ぜながら、		linebreak
	できるだけダメージをうけずにいきましょう		
333	戦闘中にアイテムを使ったり、	6471 633	linebreak
	回復晶術をかけたり、装備を変えたり		linebreak
	するのは、すこぶるイケてないと		linebreak
	いうウワサですよ		
334	高いと、どんないいことがあるのさ？	6471 634	
335	それについては調査中です先輩	6471 635	linebreak
	現世では役に立たないなどと		linebreak
	いう不届きな輩もいますが････		
336	まあ深く気にせずに自らの技術を	6471 636	linebreak
	磨けばいいさ		
337	さすが先輩、勉強になります	6471 637	
338	notice	6468 286	
339	「受身」について	6471 639	linebreak
	話し合っているようです		linebreak
	耳を傾けますか？		
340	地面にたたきつけられると	6471 640	linebreak
	倒れてしまうさ		
341	確かにつらいですね先輩	6471 641	linebreak
	でも、地面に接地したまさに		linebreak
	その瞬間に{Btn:71}を押すと、		linebreak
	受身がとれますよね		
342	ももももちろん知ってたさ	6471 642	
343	受身を取れるとダウンの時間が	6471 643	linebreak
	減るし、なによりＳＰとＴＰが		linebreak
	回復するのがうれしいですよね		
344	もももももちろん知ってたさ	6471 644	
345	notice	6468 286	
346	「戦闘難易度」について	6471 646	linebreak
	話し合っているようです		linebreak
	耳を傾けますか？		
347	戦闘難易度を高くするのに、	6471 647	linebreak
	なんの意味があるのさ？		
348	まあ確かに戦闘難易度を高くしたって	6471 648	linebreak
	世界は平和にならないですね		linebreak
	でも、噂によると、敵が落とす武具が		linebreak
	よいものになるそうです		
349	それだったら上げまくるさ	6471 649	
350	でも、知っての通り戦闘難易度を上げると、	6471 650	linebreak
	敵の攻撃力や知性が上がるうえ、		linebreak
	普通の難易度では使ってこない壮絶な攻撃を		linebreak
	してきたりするので悩みどころですよね		
351	そういうことなら一回世界を平和にするまで	6471 651	linebreak
	ＮＯＲＭＡＬでいいさ		
352	おっしゃってる意味が	6471 652	linebreak
	よくわかりませんけど		linebreak
	その通りですね		
353	ＳＥＣＯＮＤはほどよい難易度なので	6471 653	linebreak
	ちょっと手ごたえがほしかったり		linebreak
	するならお勧めな気がします		
354	notice	6468 286	
355	「通常攻撃」について	6471 655	linebreak
	深く話し合っているようです		linebreak
	耳を傾けますか？		
356	慣れてきたから最近は通常攻撃は	6471 656	linebreak
	{Btn:69}だけ叩きっぱなしさ		
357	まったくなっとらんな	6471 657	
358	実は、二段目、三段目ではある程度	6471 658	linebreak
	命中、ダメージが下がってしまうが、		linebreak
	同じ組み合わせの攻撃だと		linebreak
	より下がってしまうのだ		
359	なにー	6471 659	linebreak
	じゃあどうすればいいのさ？		
360	うむ　「{Btn:23}{Btn:69}、{Btn:69}、{Btn:22}{Btn:69}」	6471 660	linebreak
	と組み立てるなど、組み合わせを		linebreak
	変えるのがまず第一歩だ		
361	第二歩はなにさ？	6471 661	
362	{Btn:69}は攻撃力、命中の減少量が多い、	6471 662	linebreak
	{Btn:23}{Btn:69}では攻撃力が上がり命中が下がる、		linebreak
	{Btn:25}{Btn:69}では攻撃力が下がり命中が上がる、		linebreak
	{Btn:22}{Btn:69}は攻撃力、命中の減少量が少ない、		
363	以上を覚えておけ！	6471 663	linebreak
	{Btn:69}による攻撃は効果範囲が広く、		linebreak
	当たりやすいことが多いが、その反面、		linebreak
	連続攻撃時にはあまり有効ではない		
364	これは次の攻撃にも影響を与えるから、	6471 664	linebreak
	「{Btn:23}{Btn:69}、{Btn:23}{Btn:69}、{Btn:69}」と		linebreak
	「{Btn:25}{Btn:69}、{Btn:25}{Btn:69}、{Btn:69}」では、		linebreak
	三段目の攻撃の数値が変わるぞ		
365	じゃあ回避が高い敵には	6471 665	linebreak
	{Btn:25}{Btn:69}から組み立てることにするさ		linebreak
	逆に回避が低い敵には		linebreak
	{Btn:23}{Btn:69}から始めるさ		
366	例としてはそんな感じだ	6471 666	linebreak
	まあ、変化量は微々たるものだから、		linebreak
	他のルールで手一杯だというなら		linebreak
	無理して覚えなくてもいいぞ		
367	notice	6468 286	
368	「長い話」について	6471 668	linebreak
	話し合っているようです		linebreak
	耳を傾けますか？		
369	ためになる話も十年くらい聞いてると	6471 669	linebreak
	さすがにつかれるさ		
370	そういえば教えてなかったな	6471 670	linebreak
	{Btn:47}と{Btn:46}を押しっぱなしにすると		linebreak
	メッセージを早送りできる		linebreak
	同じ会話を読み飛ばすとき便利だ		
371	なにー	6471 671	linebreak
	どうして十年もそれを教えて		linebreak
	くれなかったのさ		
372	バカモン！　ひよっこのお前が	6471 672	linebreak
	私の話を読み飛ばすなどとは		linebreak
	十年早いわ		
373	と思ってたので今教えることに	6471 673	linebreak
	したわけだ		
374	納得さ	6471 674	
375	notice	6468 286	
376	「アイテム拾得」について	6471 676	linebreak
	話し合っているようです		linebreak
	耳を傾けますか？		
377	冒険者として生きるからには	6471 677	linebreak
	敵からアイテムを拾いまくりたいさ		
378	うむ　確かにそうだな	6471 678	linebreak
	しかし冒険者の間で、まことしやかな		linebreak
	噂が流れているぞ		
379	噂ってなにさ？	6471 679	
380	「どうやら同じ種類のアイテムを多く持って	6471 680	linebreak
	　いるほど敵がアイテムを落とす確率が		linebreak
	　減ってしまうようだ」というのだ		
381	そりゃ困るさ　全部売るさ	6471 681	
382	それはどうかと思うが、いらない装備品	6471 682	linebreak
	などはできるだけ売ったほうがいいのは		linebreak
	整理面でもおすすめだな		
383	もちろん	6471 683	linebreak
	リファインをして量を減らして質を		linebreak
	上げるのが冒険者の知恵ともいえるがな		
384	他にも消費アイテムを使いながら進みたい	6471 684	linebreak
	場合は、聞いた話では少な目の数をキープ		linebreak
	したほうがいいということだな		
385	消費アイテムの場合、全体の総数ではなく	6471 685	linebreak
	それぞれの所持数が関係するというのが		linebreak
	冒険者筋での通説らしいぞ		
386	でも少ないと、つえー敵で困りがちさ	6471 686	
387	それもある　それぞれの冒険スタイルに	6471 687	linebreak
	あった冒険をするのが重要ということだな		
388	NOTICE	6471 280	
389	バグってる	6471 689	
390	select	6468 137	
391	{03:0}　はい　	6468 252	linebreak
	　いいえ　		
392	{Char:01}	6468 29	
393	オレはオレの道を極めるぜ!!	6471 693	
