0			
1	ホープタウン・武器屋＆防具屋＆雑貨屋		
2	ホープタウン	6659 1	
3	武器屋＆防具屋＆雑貨屋		
4			
5	ここはホープタウン室内３です		
6			
7	ＴＯＤ２フラグを変えますか？	6471 367	pagebreak
			
8	{Char:1000}	6471 16	
9	{03:0}{Num:10000} : 第１章	6483 20	linebreak
	{Num:20000} : 第２章		linebreak
	{Num:30000} : 第３章		linebreak
	{Num:40000} : 第４章		
10	時代を変更しました	6471 370	
11	変更しませんでした	6468 134	
12			
13	{184464c0}	6471 373	
14	武器屋	6516 19	
15	いらっしゃいませ	6529 5	linebreak
	こちらでは武器を扱っています		
16	ありがとうございます	6516 21	
17	またおこしください	6516 22	
18	武器屋	6516 19	
19	防具屋	6516 26	
20	いらっしゃいませ	6529 12	linebreak
	こちらでは防具を扱っています		
21	ありがとうございます	6516 21	
22	またおこしください	6516 22	
23	防具屋	6516 26	
24	雑貨屋	6475 4	
25	いらっしゃいませ	6516 20	
26	ありがとうございました	6511 187	
27	またおこしください	6516 22	
28	雑貨屋	6475 4	
29	NOTICE	6471 280	
30	{Item:14}を手に入れました		
31			
32	これは････飛行竜のパーツだ		linebreak
	天地戦争終結後に廃棄された物だろう		
33			
34	見た事の無い機械がある		linebreak
	天地戦争時代の物だろうか		
35			
36	残骸に注意書きのメモがはられている		linebreak
	『これは空中都市の建材と思われる「生体金属」です		linebreak
	貴重な品なので持ち出さぬこと』		
37	sx = %d	6468 244	
38	sy = %d	6468 245	
39	xl = %d	6468 246	
40	yl = %d	6468 247	
41	いってらっしゃいませ	6468 248	
42	{0B:01}{143408c0}{0B:00}ガルドになりますが	6468 249	linebreak
	お泊まりになりますか？		
43	お泊まりになりますか？	6468 250	
44	select	6468 137	
45	{03:0}　はい　	6468 252	linebreak
	　いいえ　		
46	ごゆっくりお休みください	6468 253	
47	おはようございます	6468 254	
48	お金が足りません	6468 255	
49	またのおこしをお待ちしております	6468 256	
50	set_parameter( myself, C_PARTY, 0 );	6468 257	
51	wait_map_scroll();	6468 258	
52	exit-party_togather( short spd )	6468 259	
53	次のイベントは宿屋で発生します	6468 260	linebreak
	宿屋への誘導メッセージ		
54	次のイベントも宿屋で発生します	6468 261	linebreak
	宿屋への誘導メッセージ		
55	次のイベントは神殿の門で発生します	6468 262	linebreak
	神殿への誘導メッセージ		
56	次のイベントは遺跡の入口で発生します	6468 263	linebreak
	遺跡への誘導メッセージ		
57	次のイベントは村の中で発生します	6468 264	linebreak
	村の中への誘導メッセージ		
58	次のイベントは池付近で発生します	6468 265	linebreak
	池への誘導メッセージ		
59	次のイベントはスタンの家で発生します	6468 266	linebreak
	スタンの家への誘導メッセージ		
60	次のイベントはハイデルベルグ広間で発生します	6468 267	linebreak
	ハイデルベルグ城広間への誘導メッセージ		
61	次のイベントは公園付近で発生します	6468 268	linebreak
	公園付近への誘導メッセージ		
62	次のイベントは記念公園で発生します	6468 269	linebreak
	記念公園への誘導メッセージ		
63	次のイベントはハイデルベルグ城謁見の間で発生します	6468 270	linebreak
	ハイデルベルグ城謁見の間への誘導メッセージ		
64	次のイベントは城の客室で発生します	6468 271	linebreak
	客室への誘導メッセージ		
65	次のイベントは噴水広場で発生します	6468 272	linebreak
	噴水広場への誘導メッセージ		
66	次のイベントは世界地図部屋で発生します	6468 273	linebreak
	世界地図部屋への誘導メッセージ		
67	次のイベントはレアルタ資料室で発生します	6468 274	linebreak
	レアルタ資料室への誘導メッセージ		
68	次のイベントは作戦室で発生します	6468 275	linebreak
	作戦室への誘導メッセージ		
69			
70	debug	6468 277	
71	debug	6468 277	
72	時系列に対応するメッセージはありません	6468 279	
73	debug	6468 277	
74	この時系列のシナリオは、十年後のストレイライズ大神殿町キャラシナリオテキスト	6468 281	linebreak
	「1500X_??.STX」に記載しています		
75	debug	6468 277	
76	この時系列では参拝客は神殿内に配置しないので	6468 283	linebreak
	話しかけることはできない		
77	debug	6468 277	
78	この時系列のシナリオは、十年後のストレイライズ大神殿町キャラシナリオテキスト	6468 281	linebreak
	「1500X_??.STX」に記載しています		
79	notice	6468 286	
80	{1625cac0}を手に入れました	6473 112	
81	notice	6468 286	
82	{Item:4294967295}を手に入れました	6468 289	
83	notice	6468 286	
84	{1625d2c0}がありましたが	6473 116	linebreak
	いっぱいで持てませんでした		
85	notice	6468 286	
86	{1625d6c0}を受け取りましたが	6473 118	linebreak
	いっぱいで持てませんでした		
87	notice	6468 286	
88	何もありません	6468 295	
89	ベテラン	6471 501	
90	ひよっこ	6471 502	
91	notice	6468 286	
92	「武器攻撃」について	6471 504	linebreak
	話し合っているようです		linebreak
	耳を傾けますか？		
93	さて俺たちも冒険を始めるわけだが、	6471 505	linebreak
	基本は身に付いたか？		
94	もちろんさ、{Btn:69}で武器攻撃しまくりさ!!	6471 506	
95	まあそうだが方向キー{Btn:06}、{Btn:33}、{Btn:22}、{Btn:23}	6471 507	linebreak
	と組み合わせることによって、		linebreak
	四種類の攻撃が出るぞ！		
96	まずは実際に何度か繰り出してみて、	6471 508	linebreak
	速度や射程を覚えていくといいな		
97	連続攻撃はどうやればいいのさ？	6471 509	
98	攻撃中に再度{Btn:69}を押せばいい	6471 510	linebreak
	もちろん方向キー{Btn:06}、{Btn:33}、{Btn:22}、{Btn:23}		linebreak
	により攻撃方法は変わるぞ		
99	攻撃をするとスピリッツゲージが減る	6471 511	linebreak
	（ＳＰ　戦闘中の{Color:1}青いゲージ{Color:7}です）		linebreak
	減りすぎたら攻撃を控えて、		linebreak
	回復を待ったほうがいい		
100	なんでさ？　しまくりゃいいさ	6471 512	
101	スピリッツゲージが少ないと	6471 513	linebreak
	攻撃の命中・回避が下がるからな		linebreak
	かえって不利な状況になることもある		linebreak
	気をつけることだ		
102	防御が成功するとＳＰが多く回復するから、	6471 514	linebreak
	防御{Btn:71}も大切ということだな		
103	notice	6468 286	
104	「特技」について	6471 516	linebreak
	話し合っているようです		linebreak
	耳を傾けますか？		
105	どうだ、特技を覚えて	6471 517	linebreak
	戦略に幅が出たろう？		
106	特技{Btn:70}はつえーけどＴＰがすぐなくなるさ	6471 518	linebreak
	戦闘中も自動的に回復するけど、		linebreak
	まだ貧弱なので速度が遅いさ		
107	それはそうだ　そこで重要なのが	6471 519	linebreak
	{Btn:69}の通常攻撃となるわけだ		linebreak
	一回通常攻撃がヒットすると、		linebreak
	ＴＰが１回復するぞ		
108	じゃあ通常攻撃{Btn:69}しまくりさ	6471 520	
109	････ＴＰが余ってももったいないからな	6471 521	linebreak
	術を使ってＳＰを回復させるなど、		linebreak
	うまく使っていくのが大切だ		
110	ＴＰは敵を倒したときも少量回復する	6471 522	linebreak
	しかも、敵を連携中に		linebreak
	まとめて倒したりすると、		linebreak
	より多くのＴＰを回復できるのだ		
111	notice	6468 286	
112	「エンチャント」について	6471 524	linebreak
	話し合っているようです		linebreak
	耳を傾けますか？		
113	エンチャントも覚えたさ	6471 525	
114	････で、エンチャントって何さ？	6471 526	
115	うむ　簡単に言えば	6471 527	linebreak
	「覚えている特技、術を		linebreak
	　自分好みにカスタムできる能力」だな		
116	まずは使い続けて使用回数を上げること！	6471 528	linebreak
	そうすれば様々なエンチャントが		linebreak
	装備できるようになるだろう		
117	じゃあ、ひとつの特技を使いまくりさ	6471 529	
118	それもひとつの方法ではあるな	6471 530	linebreak
	ただ、戦闘中はエンチャントは変更できない		linebreak
	多くの技に多彩なエンチャントを		linebreak
	つけておくのも悪くないぞ		
119	敵の能力を下げる術を使ってから	6471 531	linebreak
	武器で切り込む････など、特技と術を		linebreak
	使いこなすことで戦略は拡がっていく		linebreak
	････仲間同士で補い合っていってもいいな		
120	ちなみに、装備したエンチャントは外せば	6471 532	linebreak
	使用回数は戻るから、いろいろと		linebreak
	試してみるのがいいだろう		
121	ボクのお気に入りの特技はあまり	6471 533	linebreak
	当たらないから、欠点を補うために		linebreak
	命中のエンチャントをつけるさ		
122	････お前の場合は単に空振りしてるだけだな	6471 534	linebreak
	空振りは、使用回数が増えないので		linebreak
	もったいないぞ！		
123	それと、回復晶術は	6471 535	linebreak
	「対象のＨＰが７５％以下のときに		linebreak
	　使用したとき」のみ		linebreak
	使用回数が増える　気をつけろ!!		
124	確かにかすり傷で使っても	6471 536	linebreak
	経験にはならないさ		
125	notice	6468 286	
126	「戦闘の作戦」について	6471 538	linebreak
	話し合っているようです		linebreak
	耳を傾けますか？		
127	いろんな敵に遭っても対処できるように、	6471 539	linebreak
	作戦を決めておこうではないか！		linebreak
	「防御がかたい敵」が現れたらどうする？		
128	みんなして術使いまくりさ	6471 540	
129	術を使うのは悪くないが、	6471 541	linebreak
	全員が術を唱えてると、		linebreak
	いいようになぐられるので、		linebreak
	前衛を一人置くのがいいな		
130	「敵の後衛が強力な術を使う」場合は？	6471 542	
131	昨日暗記して覚えたさ	6471 543	linebreak
	「術を使わせるな」で		linebreak
	詠唱をジャマするのさ		
132	まあそんな感じだ	6471 544	
133	作戦は同時に３つまで登録できるから、	6471 545	linebreak
	戦闘中に瞬時に切り替えながら闘うと、		linebreak
	見ていて気持ちがいいぞ		
134	攻撃頻度、回復割合もキャラクターの能力と	6471 546	linebreak
	敵に合わせて変えていくと、		linebreak
	より効率的な戦いが望めるだろう		
135	notice	6468 286	
136	「テクニカルスマッシュ」	6471 548	linebreak
	について話し合っているようです		linebreak
	耳を傾けますか？		
137	テクニカルスマッシュってなにさ？	6471 549	
138	うむ　戦いのプロも認める、	6471 550	linebreak
	「華麗なとどめのさし方」を行うと、		linebreak
	テクニカルスマッシュと認定される		
139	テクニカルスマッシュで敵を倒すと、	6471 551	linebreak
	あまりにステキなのか、アイテムの		linebreak
	入手確率が跳ね上がるというもっぱらの噂だ		linebreak
			
140	きっと真実だろう	6471 552	
141	連携とか、まとめて倒すとかで出まくりさ	6471 553	
142	うむ　特に「とどめは連携でさす」のは	6471 554	linebreak
	重要だ　とどめをさした時点で、その連携		linebreak
	に使っていたＳＰは全て回復するのだ		linebreak
	長い連携をしても態勢を立て直せる		
143	じゃあ追加特技とかはとどめ用にとっとくさ	6471 555	
144	ＳＰ不足に悩んでいる場合は、	6471 556	linebreak
	それがいいだろう		
145	アクションエンチャントは	6471 557	linebreak
	ＳＰを消費するのが悩みだが、		linebreak
	とどめをうまく利用するのが達人への道だ		
146	notice	6468 286	
147	「スピリッツ」について	6471 559	linebreak
	話し合っているようです		linebreak
	耳を傾けますか？		
148	敵に攻撃しても防御されまくりさ	6471 560	
149	回避が高い敵には困ったものだ	6471 561	linebreak
	術を当てるのも作戦のひとつだが、敵に		linebreak
	よっては、一回の攻撃でスピリッツを		linebreak
	激減させる一発屋もいるぞ		
150	空振りなどを誘い、スピリッツを	6471 562	linebreak
	減らすと回避の能力も落ちる････		linebreak
	そこを狙うのもいいだろう		
151	ボクは{Btn:71}と{Btn:29}のプレスガードで	6471 563	linebreak
	狙ってＳＰを減らすのさ		
152	お前は連続攻撃のときもやるから困る	6471 564	linebreak
	プレスガードは敵の最後の攻撃で行うのが		linebreak
	いい　プレスガードではＳＰは２０も減る		linebreak
	敵の攻撃を見極めることだな		
153	敵ターゲットをカスタムで表示させて	6471 565	linebreak
	いる場合、カーソルの色が明るいほど		linebreak
	ＳＰが高いということが分かる		linebreak
	戦いながら敵のＳＰを見切れるぞ		
154	notice	6468 286	
155	「連続ヒット」について	6471 567	linebreak
	話し合っているようです		linebreak
	耳を傾けますか？		
156	連続ヒットってなにさ？	6471 568	
157	ダメージを与えた敵が戦闘態勢に	6471 569	linebreak
	復帰する前に連続してダメージを与えると		linebreak
	ヒット数が加算されて表示されるのだ		
158	いっぱい当てるとどうなるのさ？	6471 570	
159	うむ　最高のヒット数は取得経験値に	6471 571	linebreak
	影響する　なぜなら、そんな素晴らしい		linebreak
	連続攻撃は何よりも勝る経験だからな		
160	より高いヒット数を求めるなら	6471 572	linebreak
	仲間との連携が不可欠だ　ヒット数とは		linebreak
	関係ない「攻撃のひと種類」は		linebreak
	ＣＨＡＩＮとして加算される		
161	ＳＰをうまい具合に使っていかないと	6471 573	linebreak
	大変さ		
162	そうだな　低いＳＰで連続攻撃に	6471 574	linebreak
	参加しても足を引っ張ってしまうのが		linebreak
	オチだな　やはりここでも術と特技の		linebreak
	バランスが重要だな		
163	notice	6468 286	
164	「影響エリア」について	6471 576	linebreak
	話し合っているようです		linebreak
	耳を傾けますか？		
165	敵の裏側から攻撃したら有利だと思ったけど	6471 577	linebreak
	なんだか疲れるさ		
166	うむ　スピリッツも含め、	6471 578	linebreak
	仲間たちとの連携が勇気を与えているので、		linebreak
	敵により分断されていると様々な		linebreak
	回復速度が落ちてしまうようだな		
167	意に反して敵の右側に回ってしまった	6471 579	linebreak
	ときは{Btn:71}＋{Btn:25}のバックステップで		linebreak
	左側に戻るといいだろう		
168	そりゃあ裏には回らないほうがいいさ	6471 580	
169	基本的にはそう考えてよいな	6471 581	linebreak
	しかし戦況を見極めてくると、		linebreak
	そのペナルティを補える働きが		linebreak
	出来るかもしれないな		
170	セオリーが全て正しいとは限らないさ	6471 582	
171	たまにはいいこと言うな	6471 583	
172	ベテランすぎ	6471 584	
173	息子	6471 585	
174	notice	6468 286	
175	「ステータス変化」について	6471 587	linebreak
	話し合っているようです		linebreak
	耳を傾けますか？		
176	戦闘でステータス異常になってしもうた	6471 588	linebreak
	パナシーアボトルもないのじゃ		linebreak
	もうダメかのう････		
177	あきらめちゃいけません父さん	6471 589	linebreak
	戦闘中にステータス異常になっても		linebreak
	時間の経過で回復するようですよ		
178	ステータス異常はレベルがあるので	6471 590	linebreak
	防止の装備をしていても軽減しきれずに		linebreak
	喰らってしまう場合があるので		linebreak
	気をつけねばいけませんね		
179	むう････また戦いにいかねばならんのか	6471 591	linebreak
	つらいのう････		
180	やはりステータス異常を回復できる	6471 592	linebreak
	料理を用意しておくのがいいですよ父さん		linebreak
	防止できる料理やアイテムもあるみたいですし		
181	後の祭りじゃあ　毒{Btn:86}に麻痺{Btn:95}に衰弱{Btn:90}に凍結に	6471 593	linebreak
	鈍足でもうへとへとじゃあ		
182	うそはいけません父さん	6471 594	linebreak
	ステータス異常は一人につき四つまでしか効果は		linebreak
	残らないのです　エンチャントで能力を		linebreak
	上げて毒が消えることもあるんです		
183	しかも凍結と鈍足は	6471 595	linebreak
	戦闘終了で回復しますよ		
184	そうじゃった　しかも鈍足は	6471 596	linebreak
	もとからじゃったの		
185	はっはっはっはっはっはっはっはっ	6471 597	linebreak
	はっはっはっはっはっはっはっは		
186	（笑いすぎじゃと思うのじゃが････）	6471 598	
187	ベテランすぎ	6471 584	
188	息子	6471 585	
189	notice	6468 286	
190	「スピリッツブラスター」	6471 602	linebreak
	について話し合っているようです		linebreak
	耳を傾けますか？		
191	ピンチになっても、スピリッツブラスター	6471 603	linebreak
	になれば逆転のチャンスができるわい		
192	スピリッツブラスターになりたいなら	6471 604	linebreak
	攻撃を当てることと敵にガードされないこと		linebreak
	が有効ですね父さん、まあ攻撃を受けてても		linebreak
	なりますけど父さんには危険ですね		
193	体力が衰えたワシも、	6471 605	linebreak
	スピリッツブラスターになれば		linebreak
	のけぞることなく攻撃できるしのう		
194	そうはいっても父さん、ＨＰがなくなれば	6471 606	linebreak
	効果が切れてしまいますし、回復晶術などを		linebreak
	かけても効果が早く切れてしまいますよ		
195	そんな細かいことは気にせんわい	6471 607	linebreak
	ワシの最高の秘奥義はスピリッツブラスター		linebreak
	にならんと見せれんでの		
196	いえ父さん　確かに秘奥義はＳＰを多く	6471 608	linebreak
	消費しますが、敵を倒すことでＳＰが		linebreak
	回復することを利用すると秘奥義を		linebreak
	出せることもあるようです		
197	ただ、弓使いにはスピリッツブラスター	6471 609	linebreak
	状態を利用して、追加晶術のかわりに		linebreak
	秘奥義を出せる人もいるらしいですよ		linebreak
	父さん		
198	まあ奥義がヒットしても敵がのけぞって	6471 610	linebreak
	ないと秘奥義にはいけぬから、		linebreak
	浮かす奥義だと重い敵にはうまく		linebreak
	いかんこともあるがの		
199	そんなわけでさっそく二人で	6471 611	linebreak
	秘奥義を出しにいこうではないか		
200	いえ父さん　私は晶術使いなんで	6471 612	linebreak
	秘奥義なんて使わないんですよ		
201	というか秘奥義の後はＳＰが０になるから	6471 613	linebreak
	すごいジャマなんですよ父さん		linebreak
	とどめもさせないのに秘奥義		linebreak
	しないでください父さん		
202	ジャマなんで	6471 614	
203	（一回言えば分かると思うが･･･）	6471 615	
204	ベテランすぎ	6471 584	
205	息子	6471 585	
206	notice	6468 286	
207	「フィールドオブエフェクト」	6471 619	linebreak
	について話し合っているようです		linebreak
	耳を傾けますか？		
208	この間の、敵が出す	6471 620	linebreak
	「フィールドオブエフェクト」には		linebreak
	ほとほと手を焼いたわい		
209	略してＦＯＥ（フォエ）ですね父さん	6471 621	linebreak
	あれには大きく二種類があって、		linebreak
	範囲内の敵たちに効果があるのと、		linebreak
	こちらの能力を下げるものがありますね		
210	あれが出たらお手上げかのう	6471 622	
211	あきらめるのは早いです父さん	6471 623	linebreak
	時間で切れるものや、ヒットを重ねることで		linebreak
	切れるものもあるんです		linebreak
	もちろん、とどめをさせば消えますしね		
212	こちらに効果のあるものを出されたら、	6471 624	linebreak
	前衛を一人だけにして術を使うのが		linebreak
	いいかのう		
213	そうですね父さん　でもやはり状態変化に	6471 625	linebreak
	応じて作戦を変えるのがいいようですよ		linebreak
	敵に効果がある場合は、スペクタクルズを		linebreak
	使えば内容が分かりますし		
214	それはそうと最近の若者は	6471 626	linebreak
	なんでもかんでも略したがって困るわい		
215	（言うのが遅いよ父さん････）	6471 627	
216	notice	6468 286	
217	「バトルグレード」について	6471 629	linebreak
	話し合っているようです		linebreak
	耳を傾けますか？		
218	バトルグレードって結局なにさ？	6471 630	
219	戦闘中の様々な行動を集計して、	6471 631	linebreak
	「戦闘のうまさ」を図るものでしたね先輩		linebreak
	ダメージの比率とか、空振りとか、		linebreak
	同じ技ばかりを使うことも審査されます		
220	高い得点を目指したい場合、	6471 632	linebreak
	やはりテクニカルスマッシュを目指しつつ、		linebreak
	エンチャントを織り交ぜながら、		linebreak
	できるだけダメージをうけずにいきましょう		
221	戦闘中にアイテムを使ったり、	6471 633	linebreak
	回復晶術をかけたり、装備を変えたり		linebreak
	するのは、すこぶるイケてないと		linebreak
	いうウワサですよ		
222	高いと、どんないいことがあるのさ？	6471 634	
223	それについては調査中です先輩	6471 635	linebreak
	現世では役に立たないなどと		linebreak
	いう不届きな輩もいますが････		
224	まあ深く気にせずに自らの技術を	6471 636	linebreak
	磨けばいいさ		
225	さすが先輩、勉強になります	6471 637	
226	notice	6468 286	
227	「受身」について	6471 639	linebreak
	話し合っているようです		linebreak
	耳を傾けますか？		
228	地面にたたきつけられると	6471 640	linebreak
	倒れてしまうさ		
229	確かにつらいですね先輩	6471 641	linebreak
	でも、地面に接地したまさに		linebreak
	その瞬間に{Btn:71}を押すと、		linebreak
	受身がとれますよね		
230	ももももちろん知ってたさ	6471 642	
231	受身を取れるとダウンの時間が	6471 643	linebreak
	減るし、なによりＳＰとＴＰが		linebreak
	回復するのがうれしいですよね		
232	もももももちろん知ってたさ	6471 644	
233	notice	6468 286	
234	「戦闘難易度」について	6471 646	linebreak
	話し合っているようです		linebreak
	耳を傾けますか？		
235	戦闘難易度を高くするのに、	6471 647	linebreak
	なんの意味があるのさ？		
236	まあ確かに戦闘難易度を高くしたって	6471 648	linebreak
	世界は平和にならないですね		linebreak
	でも、噂によると、敵が落とす武具が		linebreak
	よいものになるそうです		
237	それだったら上げまくるさ	6471 649	
238	でも、知っての通り戦闘難易度を上げると、	6471 650	linebreak
	敵の攻撃力や知性が上がるうえ、		linebreak
	普通の難易度では使ってこない壮絶な攻撃を		linebreak
	してきたりするので悩みどころですよね		
239	そういうことなら一回世界を平和にするまで	6471 651	linebreak
	ＮＯＲＭＡＬでいいさ		
240	おっしゃってる意味が	6471 652	linebreak
	よくわかりませんけど		linebreak
	その通りですね		
241	ＳＥＣＯＮＤはほどよい難易度なので	6471 653	linebreak
	ちょっと手ごたえがほしかったり		linebreak
	するならお勧めな気がします		
242	notice	6468 286	
243	「通常攻撃」について	6471 655	linebreak
	深く話し合っているようです		linebreak
	耳を傾けますか？		
244	慣れてきたから最近は通常攻撃は	6471 656	linebreak
	{Btn:69}だけ叩きっぱなしさ		
245	まったくなっとらんな	6471 657	
246	実は、二段目、三段目ではある程度	6471 658	linebreak
	命中、ダメージが下がってしまうが、		linebreak
	同じ組み合わせの攻撃だと		linebreak
	より下がってしまうのだ		
247	なにー	6471 659	linebreak
	じゃあどうすればいいのさ？		
248	うむ　「{Btn:23}{Btn:69}、{Btn:69}、{Btn:22}{Btn:69}」	6471 660	linebreak
	と組み立てるなど、組み合わせを		linebreak
	変えるのがまず第一歩だ		
249	第二歩はなにさ？	6471 661	
